{
  "schemaVersion": "0.1.0",
  "metadataType": "id_assignments",
  "modules": [
    { "id": 1, "name": "kernel32.dll", "symbol": "Kernel32" },
    { "id": 2, "name": "ntdll.dll", "symbol": "Ntdll" },
    { "id": 3, "name": "kernelbase.dll", "symbol": "KernelBase" },
    { "id": 4, "name": "advapi32.dll", "symbol": "Advapi32" },
    { "id": 5, "name": "bcrypt.dll", "symbol": "Bcrypt" },
    { "id": 6, "name": "crypt32.dll", "symbol": "Crypt32" },
    { "id": 7, "name": "rpcrt4.dll", "symbol": "Rpcrt4" },
    { "id": 8, "name": "ws2_32.dll", "symbol": "Ws2_32" },
    { "id": 9, "name": "wininet.dll", "symbol": "Wininet" },
    { "id": 10, "name": "winhttp.dll", "symbol": "Winhttp" },
    { "id": 11, "name": "user32.dll", "symbol": "User32" },
    { "id": 12, "name": "gdi32.dll", "symbol": "Gdi32" },
    { "id": 13, "name": "psapi.dll", "symbol": "Psapi" },
    { "id": 14, "name": "version.dll", "symbol": "Version" },
    { "id": 15, "name": "shell32.dll", "symbol": "Shell32" },
    { "id": 16, "name": "ole32.dll", "symbol": "Ole32" },
    { "id": 17, "name": "api-ms-win-core-winrt-l1-1-0.dll", "symbol": "ApiMsWinCoreWinrtL110" }
  ],
  "apis": [
    { "id": 1, "module": "kernel32.dll", "name": "CreateFileW", "symbol": "CreateFileW" },
    { "id": 2, "module": "kernel32.dll", "name": "CreateFileA", "symbol": "CreateFileA" },
    { "id": 3, "module": "ntdll.dll", "name": "NtCreateFile", "symbol": "NtCreateFile" },
    { "id": 4, "module": "kernel32.dll", "name": "ReadFile", "symbol": "ReadFile" },
    { "id": 5, "module": "kernel32.dll", "name": "WriteFile", "symbol": "WriteFile" },
    { "id": 6, "module": "kernel32.dll", "name": "CloseHandle", "symbol": "CloseHandle" },
    { "id": 7, "module": "kernel32.dll", "name": "LoadLibraryW", "symbol": "LoadLibraryW" },
    { "id": 8, "module": "kernel32.dll", "name": "LoadLibraryA", "symbol": "LoadLibraryA" },
    { "id": 9, "module": "kernel32.dll", "name": "LoadLibraryExW", "symbol": "LoadLibraryExW" },
    { "id": 10, "module": "kernel32.dll", "name": "LoadLibraryExA", "symbol": "LoadLibraryExA" },
    { "id": 11, "module": "ntdll.dll", "name": "LdrLoadDll", "symbol": "LdrLoadDll" },
    { "id": 12, "module": "kernel32.dll", "name": "GetProcAddress", "symbol": "GetProcAddress" },
    { "id": 13, "module": "ntdll.dll", "name": "LdrGetProcedureAddress", "symbol": "LdrGetProcedureAddress" },
    { "id": 14, "module": "advapi32.dll", "name": "RegOpenKeyExW", "symbol": "RegOpenKeyExW" },
    { "id": 15, "module": "advapi32.dll", "name": "RegCreateKeyExW", "symbol": "RegCreateKeyExW" },
    { "id": 16, "module": "advapi32.dll", "name": "RegQueryValueExW", "symbol": "RegQueryValueExW" },
    { "id": 17, "module": "advapi32.dll", "name": "RegSetValueExW", "symbol": "RegSetValueExW" },
    { "id": 18, "module": "advapi32.dll", "name": "RegDeleteValueW", "symbol": "RegDeleteValueW" },
    { "id": 19, "module": "advapi32.dll", "name": "RegCloseKey", "symbol": "RegCloseKey" },
    { "id": 20, "module": "advapi32.dll", "name": "OpenProcessToken", "symbol": "OpenProcessToken" },
    { "id": 21, "module": "advapi32.dll", "name": "AdjustTokenPrivileges", "symbol": "AdjustTokenPrivileges" },
    { "id": 22, "module": "advapi32.dll", "name": "LookupPrivilegeValueW", "symbol": "LookupPrivilegeValueW" },
    { "id": 23, "module": "advapi32.dll", "name": "OpenSCManagerW", "symbol": "OpenSCManagerW" },
    { "id": 24, "module": "advapi32.dll", "name": "OpenServiceW", "symbol": "OpenServiceW" },
    { "id": 25, "module": "advapi32.dll", "name": "CreateServiceW", "symbol": "CreateServiceW" },
    { "id": 26, "module": "advapi32.dll", "name": "StartServiceW", "symbol": "StartServiceW" },
    { "id": 27, "module": "advapi32.dll", "name": "ControlService", "symbol": "ControlService" },
    { "id": 28, "module": "advapi32.dll", "name": "DeleteService", "symbol": "DeleteService" },
    { "id": 29, "module": "bcrypt.dll", "name": "BCryptOpenAlgorithmProvider", "symbol": "BCryptOpenAlgorithmProvider" },
    { "id": 30, "module": "bcrypt.dll", "name": "BCryptCloseAlgorithmProvider", "symbol": "BCryptCloseAlgorithmProvider" },
    { "id": 31, "module": "bcrypt.dll", "name": "BCryptGetProperty", "symbol": "BCryptGetProperty" },
    { "id": 32, "module": "bcrypt.dll", "name": "BCryptSetProperty", "symbol": "BCryptSetProperty" },
    { "id": 33, "module": "bcrypt.dll", "name": "BCryptGenerateSymmetricKey", "symbol": "BCryptGenerateSymmetricKey" },
    { "id": 34, "module": "bcrypt.dll", "name": "BCryptDestroyKey", "symbol": "BCryptDestroyKey" },
    { "id": 35, "module": "bcrypt.dll", "name": "BCryptEncrypt", "symbol": "BCryptEncrypt" },
    { "id": 36, "module": "bcrypt.dll", "name": "BCryptDecrypt", "symbol": "BCryptDecrypt" },
    { "id": 37, "module": "bcrypt.dll", "name": "BCryptGenRandom", "symbol": "BCryptGenRandom" },
    { "id": 38, "module": "bcrypt.dll", "name": "BCryptHashData", "symbol": "BCryptHashData" },
    { "id": 39, "module": "crypt32.dll", "name": "CertOpenStore", "symbol": "CertOpenStore" },
    { "id": 40, "module": "crypt32.dll", "name": "CertCloseStore", "symbol": "CertCloseStore" },
    { "id": 41, "module": "crypt32.dll", "name": "CertFindCertificateInStore", "symbol": "CertFindCertificateInStore" },
    { "id": 42, "module": "crypt32.dll", "name": "CertFreeCertificateContext", "symbol": "CertFreeCertificateContext" },
    { "id": 43, "module": "crypt32.dll", "name": "CertGetCertificateChain", "symbol": "CertGetCertificateChain" },
    { "id": 44, "module": "crypt32.dll", "name": "CertVerifyCertificateChainPolicy", "symbol": "CertVerifyCertificateChainPolicy" },
    { "id": 45, "module": "crypt32.dll", "name": "CryptQueryObject", "symbol": "CryptQueryObject" },
    { "id": 46, "module": "crypt32.dll", "name": "CryptMsgOpenToDecode", "symbol": "CryptMsgOpenToDecode" },
    { "id": 47, "module": "crypt32.dll", "name": "CryptMsgUpdate", "symbol": "CryptMsgUpdate" },
    { "id": 48, "module": "crypt32.dll", "name": "CryptMsgClose", "symbol": "CryptMsgClose" },
    { "id": 49, "module": "rpcrt4.dll", "name": "RpcStringBindingComposeW", "symbol": "RpcStringBindingComposeW" },
    { "id": 50, "module": "rpcrt4.dll", "name": "RpcBindingFromStringBindingW", "symbol": "RpcBindingFromStringBindingW" },
    { "id": 51, "module": "rpcrt4.dll", "name": "RpcStringFreeW", "symbol": "RpcStringFreeW" },
    { "id": 52, "module": "rpcrt4.dll", "name": "RpcBindingFree", "symbol": "RpcBindingFree" },
    { "id": 53, "module": "rpcrt4.dll", "name": "RpcBindingSetAuthInfoW", "symbol": "RpcBindingSetAuthInfoW" },
    { "id": 54, "module": "rpcrt4.dll", "name": "RpcBindingSetOption", "symbol": "RpcBindingSetOption" },
    { "id": 55, "module": "rpcrt4.dll", "name": "RpcMgmtEpEltInqBegin", "symbol": "RpcMgmtEpEltInqBegin" },
    { "id": 56, "module": "rpcrt4.dll", "name": "RpcMgmtEpEltInqNextW", "symbol": "RpcMgmtEpEltInqNextW" },
    { "id": 57, "module": "rpcrt4.dll", "name": "RpcMgmtEpEltInqDone", "symbol": "RpcMgmtEpEltInqDone" },
    { "id": 58, "module": "rpcrt4.dll", "name": "UuidCreate", "symbol": "UuidCreate" },
    { "id": 59, "module": "ws2_32.dll", "name": "WSAStartup", "symbol": "WSAStartup" },
    { "id": 60, "module": "ws2_32.dll", "name": "WSACleanup", "symbol": "WSACleanup" },
    { "id": 61, "module": "ws2_32.dll", "name": "socket", "symbol": "Socket" },
    { "id": 62, "module": "ws2_32.dll", "name": "closesocket", "symbol": "Closesocket" },
    { "id": 63, "module": "ws2_32.dll", "name": "connect", "symbol": "Connect" },
    { "id": 64, "module": "ws2_32.dll", "name": "send", "symbol": "Send" },
    { "id": 65, "module": "ws2_32.dll", "name": "recv", "symbol": "Recv" },
    { "id": 66, "module": "ws2_32.dll", "name": "sendto", "symbol": "SendTo" },
    { "id": 67, "module": "ws2_32.dll", "name": "recvfrom", "symbol": "RecvFrom" },
    { "id": 68, "module": "ws2_32.dll", "name": "getaddrinfo", "symbol": "GetAddrInfo" },
    { "id": 69, "module": "ws2_32.dll", "name": "freeaddrinfo", "symbol": "FreeAddrInfo" },
    { "id": 70, "module": "ws2_32.dll", "name": "WSAGetLastError", "symbol": "WSAGetLastError" },
    { "id": 71, "module": "wininet.dll", "name": "InternetOpenW", "symbol": "InternetOpenW" },
    { "id": 72, "module": "wininet.dll", "name": "InternetCloseHandle", "symbol": "InternetCloseHandle" },
    { "id": 73, "module": "wininet.dll", "name": "InternetConnectW", "symbol": "InternetConnectW" },
    { "id": 74, "module": "wininet.dll", "name": "InternetOpenUrlW", "symbol": "InternetOpenUrlW" },
    { "id": 75, "module": "wininet.dll", "name": "HttpOpenRequestW", "symbol": "HttpOpenRequestW" },
    { "id": 76, "module": "wininet.dll", "name": "HttpSendRequestW", "symbol": "HttpSendRequestW" },
    { "id": 77, "module": "wininet.dll", "name": "InternetReadFile", "symbol": "InternetReadFile" },
    { "id": 78, "module": "wininet.dll", "name": "InternetWriteFile", "symbol": "InternetWriteFile" },
    { "id": 79, "module": "wininet.dll", "name": "InternetSetOptionW", "symbol": "InternetSetOptionW" },
    { "id": 80, "module": "wininet.dll", "name": "InternetQueryOptionW", "symbol": "InternetQueryOptionW" },
    { "id": 81, "module": "winhttp.dll", "name": "WinHttpOpen", "symbol": "WinHttpOpen" },
    { "id": 82, "module": "winhttp.dll", "name": "WinHttpCloseHandle", "symbol": "WinHttpCloseHandle" },
    { "id": 83, "module": "winhttp.dll", "name": "WinHttpConnect", "symbol": "WinHttpConnect" },
    { "id": 84, "module": "winhttp.dll", "name": "WinHttpOpenRequest", "symbol": "WinHttpOpenRequest" },
    { "id": 85, "module": "winhttp.dll", "name": "WinHttpSendRequest", "symbol": "WinHttpSendRequest" },
    { "id": 86, "module": "winhttp.dll", "name": "WinHttpReceiveResponse", "symbol": "WinHttpReceiveResponse" },
    { "id": 87, "module": "winhttp.dll", "name": "WinHttpReadData", "symbol": "WinHttpReadData" },
    { "id": 88, "module": "winhttp.dll", "name": "WinHttpWriteData", "symbol": "WinHttpWriteData" },